{
  "format": "sierra-hd-hints",
  "version": 1,
  "picture": 24,
  "pic_sha256": "64d38d5d2647fd26708d966a28c5d45b3e9ca8f5c997791825e2f13c8bc643aa",
  "analyser": "Claude (AI-assisted review of sci-hint-tool candidates), 2026-10-21",
  "regions": [
    {"id": "night-sky", "at": [20, 30], "label": "night sky"},
    {"id": "oak-trunk", "at": [100, 100], "label": "oak trunk"},
    {"id": "gazebo-steps", "at": [190, 140], "label": "gazebo steps"},
    {"id": "lawn", "at": [50, 150], "label": "lawn"},
    {"id": "dirt-path", "at": [186, 180], "label": "dirt path", "uncertain": true},
    {"id": "background-hedge", "at": [13, 106], "label": "background hedge", "uncertain": true}
  ],
  "chains": [
    {"id": "gazebo-dome-left-edge", "lines": [280, 281, 282, 283, 284, 285], "primitive": "spline", "label": "gazebo dome, left edge"},
    {"id": "gazebo-dome-rib", "lines": [300, 301, 302, 303, 304], "primitive": "spline", "label": "gazebo dome rib"},
    {"id": "oak-branch-right", "lines": [61, 62, 63, 64, 65, 66], "primitive": "spline", "label": "oak branch, right"},
    {"id": "oak-foliage-right-edge", "lines": [96, 97, 98, 99, 100], "primitive": "spline", "label": "oak foliage, right edge", "uncertain": true},
    {"id": "oak-foliage-outline", "lines": [112, 113, 114, 115], "primitive": "spline", "label": "oak foliage outline"},
    {"id": "oak-foliage-outline-2", "lines": [135, 136, 137, 138], "primitive": "spline", "label": "oak foliage outline"},
    {"id": "small-foliage-clump", "lines": [139, 140, 141, 142, 143], "primitive": "spline", "label": "small foliage clump", "uncertain": true},
    {"id": "oak-branch-edge-left", "lines": [367, 368, 369, 370], "primitive": "spline", "label": "oak branch edge, left"},
    {"id": "foliage-clump-outline", "lines": [389, 390, 391, 392, 393], "primitive": "spline", "label": "foliage clump outline"},
    {"id": "foliage-clump-top", "lines": [404, 406, 407], "primitive": "spline", "label": "foliage clump top"},
    {"id": "foliage-clump-outline-2", "lines": [449, 450, 451, 453, 454, 455], "primitive": "spline", "label": "foliage clump outline"},
    {"id": "small-foliage-tip", "lines": [465, 466, 467], "primitive": "spline", "label": "small foliage tip", "uncertain": true},
    {"id": "oak-trunk-base", "lines": [472, 473, 474, 475, 476, 477, 478], "primitive": "spline", "label": "oak trunk base"},
    {"id": "hanging-moss-left", "lines": [1198, 1199, 1200, 1201], "primitive": "spline", "label": "hanging moss, left"},
    {"id": "hanging-moss-strand", "lines": [1315, 1316, 1317], "primitive": "spline", "label": "hanging moss strand"},
    {"id": "hanging-moss-right", "lines": [1361, 1362, 1363], "primitive": "spline", "label": "hanging moss, right", "uncertain": true},
    {"id": "background-tree-outline", "lines": [793, 794, 795, 796, 797], "primitive": "spline", "label": "background tree outline", "uncertain": true},
    {"id": "background-tree-outline-2", "lines": [1419, 1420, 1421], "primitive": "spline", "label": "background tree outline", "uncertain": true},
    {"id": "background-bush-outline", "lines": [1098, 1099, 1100], "primitive": "spline", "label": "background bush outline", "uncertain": true},
    {"id": "background-bush-outline-2", "lines": [1115, 1116, 1117], "primitive": "spline", "label": "background bush outline", "uncertain": true},
    {"id": "background-bush-outline-3", "lines": [1118, 1119, 1120, 1121], "primitive": "spline", "label": "background bush outline", "uncertain": true},
    {"id": "background-bush-outline-4", "lines": [1483, 1484, 1485], "primitive": "spline", "label": "background bush outline", "uncertain": true},
    {"id": "bush-behind-railing", "lines": [1448, 1449, 1450, 1451, 1452, 1453, 1454], "primitive": "spline", "label": "bush behind railing", "uncertain": true},
    {"id": "bush-behind-railing-2", "lines": [1463, 1464, 1465, 1466], "primitive": "spline", "label": "bush behind railing", "uncertain": true},
    {"id": "bush-behind-railing-3", "lines": [1467, 1468, 1469], "primitive": "spline", "label": "bush behind railing", "uncertain": true},
    {"id": "bush-behind-railing-4", "lines": [1470, 1471, 1472, 1473, 1474], "primitive": "spline", "label": "bush behind railing", "uncertain": true},
    {"id": "distant-tree-trunk", "lines": [1215, 1216, 1217, 1218, 1219], "primitive": "spline", "label": "distant tree trunk", "uncertain": true},
    {"id": "small-distant-bush", "lines": [1254, 1255, 1256, 1257, 1258, 1259], "primitive": "spline", "label": "small distant bush", "uncertain": true},
    {"id": "oak-trunk-edge", "lines": [1819, 1820, 1821], "primitive": "spline", "label": "oak trunk edge", "uncertain": true},
    {"id": "path-edge-left", "lines": [483, 484, 485], "primitive": "spline", "label": "path edge, left", "uncertain": true},
    {"id": "path-edge-right", "lines": [487, 488, 489], "primitive": "spline", "label": "path edge, right", "uncertain": true},
    {"id": "grass-edge-by-path", "lines": [730, 731, 732], "primitive": "spline", "label": "grass edge by path", "uncertain": true},
    {"id": "grass-edge-by-path-2", "lines": [716, 717, 718], "primitive": "spline", "label": "grass edge by path", "uncertain": true},
    {"id": "lawn-contour", "lines": [705, 706, 707], "primitive": "spline", "label": "lawn contour", "uncertain": true},
    {"id": "lawn-contour-left", "lines": [708, 709, 710], "primitive": "spline", "label": "lawn contour, left", "uncertain": true},
    {"id": "lawn-edge-right", "lines": [1571, 1572, 1573], "primitive": "spline", "label": "lawn edge, right", "uncertain": true},
    {"id": "lawn-edge-right-2", "lines": [1652, 1653, 1654], "primitive": "spline", "label": "lawn edge, right", "uncertain": true},
    {"id": "grass-tuft-right", "lines": [1644, 1645, 1646], "primitive": "spline", "label": "grass tuft, right", "uncertain": true}
  ]
}
