{
  "format": "sierra-hd-hints",
  "version": 1,
  "picture": 22,
  "pic_sha256": "6c6bb1780702d719927b74bc7e4ffec37910aab257ccf5f71745a00cf4e28ba5",
  "analyser": "Claude (AI-assisted review of sci-hint-tool candidates), 2026-10-21",
  "regions": [
    {"id": "mansion-facade", "at": [160, 40], "label": "mansion facade"},
    {"id": "night-sky", "at": [160, 5], "label": "night sky"},
    {"id": "front-walk", "at": [160, 140], "label": "front walk"},
    {"id": "fountain", "at": [160, 160], "label": "fountain"},
    {"id": "hedge-beds", "at": [60, 140], "label": "hedge beds"},
    {"id": "garden-bed", "at": [260, 170], "label": "garden bed"},
    {"id": "tree-left", "at": [30, 70], "label": "tree, left"}
  ],
  "chains": [
    {"id": "central-window-arch", "lines": [179, 180, 181, 182], "primitive": "arc", "label": "central window arch"},
    {"id": "round-fountain-rim", "lines": [604, 605, 606, 607, 608, 609], "primitive": "arc", "label": "round fountain rim"},
    {"id": "lawn-edge", "lines": [222, 223, 224, 225, 226], "primitive": "arc", "label": "lawn edge", "uncertain": true},
    {"id": "tree-canopy-left", "lines": [1797, 1798, 1799, 1800, 1801], "primitive": "spline", "label": "tree canopy, left"},
    {"id": "tree-branch-left", "lines": [1788, 1789, 1790, 1791], "primitive": "spline", "label": "tree branch, left", "uncertain": true},
    {"id": "tree-canopy-right", "lines": [1657, 1658, 1659, 1660, 1661, 1662, 1663], "primitive": "spline", "label": "tree canopy, right"},
    {"id": "tree-branch-right", "lines": [294, 295, 296, 297, 298], "primitive": "spline", "label": "tree branch, right"},
    {"id": "tree-trunk-right", "lines": [278, 279, 280, 281], "primitive": "spline", "label": "tree trunk, right"},
    {"id": "tree-root-right", "lines": [387, 388, 389, 390], "primitive": "spline", "label": "tree root, right", "uncertain": true},
    {"id": "tree-root-right-2", "lines": [393, 394, 395, 396], "primitive": "spline", "label": "tree root, right", "uncertain": true},
    {"id": "garden-bed-edge", "lines": [2276, 2277, 2278, 2279, 2280, 2281], "primitive": "spline", "label": "garden bed edge", "uncertain": true},
    {"id": "garden-bed-edge-2", "lines": [2030, 2031, 2032], "primitive": "spline", "label": "garden bed edge", "uncertain": true},
    {"id": "flower-bed-edge", "lines": [2563, 2564, 2565, 2566, 2567, 2568], "primitive": "spline", "label": "flower bed edge", "uncertain": true},
    {"id": "flower-bed-edge-2", "lines": [2569, 2570, 2571], "primitive": "spline", "label": "flower bed edge", "uncertain": true},
    {"id": "flower-bed-edge-3", "lines": [2642, 2643, 2644], "primitive": "spline", "label": "flower bed edge", "uncertain": true},
    {"id": "flower-bed-edge-4", "lines": [2654, 2655, 2656, 2657], "primitive": "spline", "label": "flower bed edge", "uncertain": true}
  ]
}
