{
  "format": "sierra-hd-hints",
  "version": 1,
  "picture": 2,
  "pic_sha256": "26aeca0b668a674de84c96afbefe2e989d315443b266077a33354451ab3b0272",
  "analyser": "Claude (AI-assisted review of sci-hint-tool candidates), 2026-10-21",
  "regions": [
    {"id": "night-sky", "at": [160, 10], "label": "night sky"},
    {"id": "mausoleum", "at": [160, 60], "label": "mausoleum"},
    {"id": "left-crypt", "at": [40, 60], "label": "left crypt"},
    {"id": "graveyard-ground", "at": [180, 160], "label": "graveyard ground"},
    {"id": "stone-tomb", "at": [160, 140], "label": "stone tomb"},
    {"id": "iron-railing", "at": [290, 140], "label": "iron railing"},
    {"id": "right-tree", "at": [300, 80], "label": "right tree"}
  ],
  "chains": [
    {"id": "left-tree-trunk-edge", "lines": [33, 34, 35, 36, 37, 38, 39, 41], "primitive": "spline", "label": "left tree trunk edge"},
    {"id": "left-tree-trunk-edge-2", "lines": [43, 44, 45, 46, 47, 48, 49, 50, 51], "primitive": "spline", "label": "left tree trunk edge"},
    {"id": "tree-branch-by-crypt", "lines": [58, 59, 61], "primitive": "spline", "label": "tree branch by crypt", "uncertain": true},
    {"id": "curving-tree-branch", "lines": [68, 69, 70, 71, 72, 73, 74, 75, 76, 77, 78], "primitive": "spline", "label": "curving tree branch"},
    {"id": "tree-trunk-base", "lines": [79, 80, 81, 82], "primitive": "spline", "label": "tree trunk base"},
    {"id": "tree-trunk-base-2", "lines": [85, 86, 87, 88], "primitive": "spline", "label": "tree trunk base", "uncertain": true},
    {"id": "tombstone-rounded-top", "lines": [121, 122, 123, 124], "primitive": "arc", "label": "tombstone rounded top"},
    {"id": "tombstone-rounded-top-2", "lines": [163, 164, 165], "primitive": "arc", "label": "tombstone rounded top", "uncertain": true},
    {"id": "small-tombstone-outline", "lines": [207, 208, 209, 210], "primitive": "spline", "label": "small tombstone outline", "uncertain": true},
    {"id": "small-tombstone-top", "lines": [262, 263, 264, 265], "primitive": "arc", "label": "small tombstone top", "uncertain": true},
    {"id": "tombstone-rounded-top-3", "lines": [365, 366, 367, 368], "primitive": "arc", "label": "tombstone rounded top"},
    {"id": "crypt-right-edge", "lines": [510, 511, 512, 513, 514, 515], "primitive": "spline", "label": "crypt right edge", "uncertain": true},
    {"id": "tree-branch", "lines": [516, 517, 518], "primitive": "spline", "label": "tree branch"},
    {"id": "tree-trunk-upper-left", "lines": [528, 529, 530, 531, 532], "primitive": "spline", "label": "tree trunk, upper left"},
    {"id": "tree-branch-2", "lines": [541, 542, 543], "primitive": "spline", "label": "tree branch"},
    {"id": "tree-branch-3", "lines": [544, 545, 546], "primitive": "spline", "label": "tree branch"},
    {"id": "tree-branch-4", "lines": [547, 548, 549, 550], "primitive": "spline", "label": "tree branch"},
    {"id": "tree-trunk-left-side", "lines": [658, 659, 660, 661, 662, 663, 664], "primitive": "spline", "label": "tree trunk, left side"},
    {"id": "tree-branch-5", "lines": [687, 688, 689, 690, 691, 692, 693, 694, 695, 696], "primitive": "spline", "label": "tree branch"},
    {"id": "tree-branch-6", "lines": [697, 698, 699, 700, 701], "primitive": "spline", "label": "tree branch"},
    {"id": "tree-trunk-far-left", "lines": [715, 716, 717, 718, 719, 720, 721, 722], "primitive": "spline", "label": "tree trunk, far left"},
    {"id": "tree-branch-7", "lines": [733, 734, 735, 736], "primitive": "spline", "label": "tree branch"},
    {"id": "tree-trunk-edge", "lines": [856, 857, 858], "primitive": "spline", "label": "tree trunk edge", "uncertain": true},
    {"id": "tree-trunk-edge-2", "lines": [863, 864, 865], "primitive": "spline", "label": "tree trunk edge", "uncertain": true},
    {"id": "small-branch", "lines": [1670, 1671, 1672], "primitive": "spline", "label": "small branch", "uncertain": true},
    {"id": "small-branch-2", "lines": [1673, 1674, 1675], "primitive": "spline", "label": "small branch", "uncertain": true},
    {"id": "tree-root-edge", "lines": [1722, 1723, 1724], "primitive": "spline", "label": "tree root edge", "uncertain": true},
    {"id": "dead-weeds-by-crypt", "lines": [2023, 2024, 2025, 2026], "primitive": "spline", "label": "dead weeds by crypt", "uncertain": true},
    {"id": "dead-weeds-by-crypt-2", "lines": [2027, 2028, 2029], "primitive": "spline", "label": "dead weeds by crypt", "uncertain": true},
    {"id": "right-tree-branch", "lines": [1327, 1328, 1329], "primitive": "spline", "label": "right tree branch"},
    {"id": "right-tree-branch-2", "lines": [1330, 1331, 1332, 1333, 1334, 1335, 1336, 1337], "primitive": "spline", "label": "right tree branch"},
    {"id": "right-tree-branch-3", "lines": [1343, 1344, 1345, 1346, 1347, 1348], "primitive": "spline", "label": "right tree branch"},
    {"id": "right-tree-branch-4", "lines": [1355, 1356, 1357, 1358, 1359, 1360, 1361], "primitive": "spline", "label": "right tree branch"},
    {"id": "right-tree-branch-5", "lines": [1362, 1363, 1364, 1365, 1366], "primitive": "spline", "label": "right tree branch"},
    {"id": "right-tree-branch-6", "lines": [1395, 1396, 1397, 1398], "primitive": "spline", "label": "right tree branch"},
    {"id": "right-tree-branch-7", "lines": [2157, 2158, 2159, 2160, 2161, 2162], "primitive": "spline", "label": "right tree branch"},
    {"id": "right-tree-twig", "lines": [2174, 2175, 2176], "primitive": "spline", "label": "right tree twig"},
    {"id": "right-tree-twig-2", "lines": [2199, 2200, 2201], "primitive": "spline", "label": "right tree twig"},
    {"id": "right-tree-branch-8", "lines": [2212, 2213, 2214, 2215], "primitive": "spline", "label": "right tree branch"},
    {"id": "right-tree-twig-3", "lines": [2219, 2220, 2221], "primitive": "spline", "label": "right tree twig"},
    {"id": "right-tree-branch-9", "lines": [2239, 2240, 2241, 2242], "primitive": "spline", "label": "right tree branch"},
    {"id": "right-tree-branch-10", "lines": [2244, 2245, 2246], "primitive": "spline", "label": "right tree branch"},
    {"id": "right-tree-branch-11", "lines": [2250, 2251, 2252, 2253], "primitive": "spline", "label": "right tree branch"},
    {"id": "right-tree-branch-12", "lines": [2254, 2255, 2256, 2257], "primitive": "spline", "label": "right tree branch"},
    {"id": "right-tree-branch-13", "lines": [2262, 2263, 2264], "primitive": "spline", "label": "right tree branch"},
    {"id": "right-tree-twig-4", "lines": [2293, 2294, 2295], "primitive": "spline", "label": "right tree twig"},
    {"id": "right-tree-twig-5", "lines": [2297, 2298, 2299], "primitive": "spline", "label": "right tree twig"},
    {"id": "right-tree-branch-14", "lines": [2300, 2301, 2302], "primitive": "spline", "label": "right tree branch"},
    {"id": "right-tree-branch-15", "lines": [2306, 2307, 2308, 2309], "primitive": "spline", "label": "right tree branch"},
    {"id": "right-tree-twig-6", "lines": [2404, 2405, 2406], "primitive": "spline", "label": "right tree twig"},
    {"id": "tree-branch-over-crypt", "lines": [2453, 2454, 2455, 2456, 2457], "primitive": "spline", "label": "tree branch over crypt"},
    {"id": "tree-branch-8", "lines": [2475, 2476, 2477, 2478], "primitive": "spline", "label": "tree branch"}
  ]
}
