{
  "format": "sierra-hd-hints",
  "version": 1,
  "picture": 85,
  "pic_sha256": "555d741900b89be5d37d97a60bb6f92ba4098bc61be83afa4907ea3692d4cc19",
  "analyser": "Claude (AI-assisted review of sci-hint-tool candidates), 2026-10-21",
  "regions": [
    {"id": "left-dress", "at": [110, 80], "label": "left dress"},
    {"id": "right-garment", "at": [225, 90], "label": "right garment"},
    {"id": "middle-garment", "at": [160, 120], "label": "middle garment"},
    {"id": "gravestone", "at": [190, 25], "label": "gravestone"},
    {"id": "muddy-ground", "at": [80, 50], "label": "muddy ground"}
  ],
  "chains": [
    {"id": "right-garment-shoulder", "lines": [125, 126, 127], "primitive": "spline", "label": "right garment shoulder"},
    {"id": "right-garment-sleeve", "lines": [133, 134, 135], "primitive": "spline", "label": "right garment sleeve"},
    {"id": "right-garment-sleeve-2", "lines": [147, 148, 149, 150], "primitive": "spline", "label": "right garment sleeve"},
    {"id": "right-garment-hem", "lines": [160, 161, 162], "primitive": "spline", "label": "right garment hem"},
    {"id": "right-garment-outline", "lines": [186, 188, 189, 190, 191, 192, 193, 195, 196], "primitive": "spline", "label": "right garment outline"},
    {"id": "right-garment-fold", "lines": [230, 231, 232], "primitive": "spline", "label": "right garment fold"},
    {"id": "right-garment-hem-2", "lines": [351, 352, 353, 354, 355], "primitive": "spline", "label": "right garment hem"},
    {"id": "right-garment-sleeve-3", "lines": [370, 371, 372], "primitive": "spline", "label": "right garment sleeve"},
    {"id": "middle-garment-outline", "lines": [487, 488, 489, 491], "primitive": "spline", "label": "middle garment outline"},
    {"id": "middle-garment-outline-2", "lines": [493, 494, 495, 496], "primitive": "spline", "label": "middle garment outline"},
    {"id": "middle-garment-fold", "lines": [503, 504, 505, 506, 507], "primitive": "spline", "label": "middle garment fold"},
    {"id": "middle-garment-fold-2", "lines": [537, 538, 539], "primitive": "spline", "label": "middle garment fold"},
    {"id": "middle-garment-outline-3", "lines": [550, 551, 552], "primitive": "spline", "label": "middle garment outline"},
    {"id": "middle-garment-sleeve", "lines": [613, 614, 615], "primitive": "spline", "label": "middle garment sleeve"},
    {"id": "middle-garment-collar", "lines": [616, 617, 618], "primitive": "spline", "label": "middle garment collar"},
    {"id": "left-dress-outline", "lines": [675, 676, 677, 678, 679, 680, 682, 683], "primitive": "spline", "label": "left dress outline"},
    {"id": "left-dress-sleeve", "lines": [694, 695, 696], "primitive": "spline", "label": "left dress sleeve"},
    {"id": "left-dress-outline-2", "lines": [703, 704, 705, 706, 707, 708, 709], "primitive": "spline", "label": "left dress outline"},
    {"id": "left-dress-shoulder", "lines": [713, 714, 715, 716], "primitive": "spline", "label": "left dress shoulder"},
    {"id": "green-cloth-outline", "lines": [929, 930, 931], "primitive": "spline", "label": "green cloth outline"},
    {"id": "ground-streak", "lines": [831, 832, 833, 834], "primitive": "spline", "label": "ground streak", "uncertain": true},
    {"id": "ground-streak-2", "lines": [848, 849, 850, 851, 852], "primitive": "spline", "label": "ground streak", "uncertain": true},
    {"id": "ground-streak-3", "lines": [853, 854, 855, 856, 857, 858, 859, 860, 861, 862, 863, 864, 865, 866, 867], "primitive": "spline", "label": "ground streak"},
    {"id": "ground-streak-right", "lines": [909, 910, 911], "primitive": "spline", "label": "ground streak, right", "uncertain": true},
    {"id": "ground-streak-right-2", "lines": [912, 913, 914, 915], "primitive": "spline", "label": "ground streak, right", "uncertain": true},
    {"id": "ground-streak-left", "lines": [942, 943, 944, 945], "primitive": "spline", "label": "ground streak, left", "uncertain": true},
    {"id": "ground-streak-left-2", "lines": [956, 957, 958], "primitive": "spline", "label": "ground streak, left", "uncertain": true},
    {"id": "garment-edge-far-right", "lines": [964, 965, 966], "primitive": "spline", "label": "garment edge, far right", "uncertain": true}
  ]
}
